{
 "candidate_id": "las-b12-003",
 "section": "LÄS",
 "family": "laxor-grundskolan-debatt-short",
 "title": "Läxan är en förflyttning, inte en metod",
 "passage": "Diskussionen om läxor förs som om läxan vore en undervisningsmetod bland andra, jämförbar med grupparbete eller genomgång. Det är den inte. Läxan är en förflyttning. Arbetet lämnar ett rum där det finns en utbildad lärare och landar vid ett köksbord där det finns någon annan — eller ingen alls. Det mesta följer av den skillnaden.\n\nTorbjörn Elmerud vid Lärarhögskolan i Vretstorp följde under läsåret 2022/23 arton klasser i årskurs sex. Eleverna antecknade själva hur lång tid varje hemuppgift tog. Medelvärdena sade inte mycket. Spridningen sade desto mer: samma uppgift, samma klass, och ändå en variation från tio minuter till drygt en timme. Där en vuxen kunde sätta sig bredvid blev arbetet kortare; där ingen kunde det drog det ut på tiden eller blev inte gjort alls. Skillnaderna mellan eleverna var störst i matematikläxan, mindre i läsläxan och minst i den läxa där eleverna skulle läsa högt för någon.\n\nElmerud är noga med gränserna för sitt material. Han har inte mätt kunskapsutveckling över huvud taget, bara tid och tillgång till hjälp, och han påpekar att en läxa som tar lång tid inte behöver vara en dålig läxa. Kommunal läxhjälp fanns vid sju av skolorna, men söktes framför allt av elever vars vuxna redan visste att den fanns. En av lärarna hade i tio år låtit eleverna välja mellan att ta med uppgiften hem och att stanna kvar tjugo minuter efter sista lektionen. Ungefär hälften stannade. Det var, skriver Elmerud, inte de elever man hade gissat.\n\nJag är ingen läxmotståndare. Att lyssna på en sjuåring som läser högt är inte förtryck, och glosor måste nötas någonstans. Att skolan inte hinner med kursinnehållet är ett verkligt bekymmer, men det är schemats bekymmer och inte läxans. Min invändning gäller något annat: det som ska göras hemma bör vara sådant som går att göra utan lärare. Matematiken är sällan sådan. Och så länge uppgiften är obligatorisk och bedöms som om alla hade samma kök att sitta vid, mäter vi inte elevens arbete utan hemmets.\n\nDet gör mig inte till motståndare. Det gör mig tveksam till att kalla en förflyttning för en metod.\n— Marit Hallgren, lärare i matematik och NO\n\nläxhjälp = organiserat stöd med hemuppgifter utanför lektionstid",
 "questions": [
  {
   "q_index": 1,
   "prompt": "Vad visade, enligt texten, Elmeruds mätningar av tiden för olika läxor?",
   "options": [
    {
     "letter": "A",
     "text": "Variationen var störst i högläsningsläxan och minst i matematikläxan."
    },
    {
     "letter": "B",
     "text": "Matematikläxan gav de största skillnaderna mellan eleverna, högläsningsläxan de minsta."
    },
    {
     "letter": "C",
     "text": "Variationen var ungefär lika stor oavsett vilken av läxtyperna det gällde."
    },
    {
     "letter": "D",
     "text": "Matematikläxan var den läxa som oftast lämnades ogjord av eleverna."
    }
   ],
   "key": "B",
   "rationale": "Nyckeln B parafraserar den avslutande meningen i stycke 2: skillnaderna mellan eleverna var störst i matematikläxan, mindre i läsläxan och minst i den läxa där eleverna skulle läsa högt för någon. Rangordningen är uttrycklig och ligger på ett ställe i texten; nyckeln är ett rakt, specifikt påstående utan gardering. A är reversed_causality i sin enklaste form — rangordningen vänd ände för ände. Fällan är stark eftersom högläsning intuitivt känns som den läxa som är mest beroende av en vuxen hemma, och en textblind läsare kan inte skilja de två riktningarna åt. C är overgeneralisation: den suddar ut hela ämnesskillnaden och gör mönstret enhetligt, vilket är precis vad texten avstår från att påstå. D är scope_shift på ett riktigt textställe: att arbetet ”blev inte gjort alls” står i meningen om hem utan hjälp, inte om matematik som ämne, så alternativet flyttar en verklig uppgift till fel avgränsning och är därmed inte ordagrant sant."
  },
  {
   "q_index": 2,
   "prompt": "Vilket påstående överensstämmer bäst med texten?",
   "options": [
    {
     "letter": "A",
     "text": "Elmeruds undersökning visar att läxor betyder förhållandevis lite för vad eleverna lär sig."
    },
    {
     "letter": "B",
     "text": "Läxor bör avskaffas i grundskolan, eftersom de systematiskt gynnar de elever som har mest stöd hemma."
    },
    {
     "letter": "C",
     "text": "Det största problemet i skolan är att lektionstiden inte räcker till för kursinnehållet."
    },
    {
     "letter": "D",
     "text": "Läxan flyttar arbetet hem, och därför mäter den hemmets förutsättningar lika mycket som elevens insats."
    }
   ],
   "key": "D",
   "rationale": "Nyckeln D spänner över hela texten: inledningens tes att läxan är en förflyttning från ett rum med lärare till ett köksbord, studiens fynd i stycke 2 om att spridningen följde tillgången på en vuxen som kunde sätta sig bredvid, och slutsatsen i stycke 4 att en obligatorisk och bedömd uppgift mäter hemmet snarare än elevens arbete. Inget enskilt stycke räcker för att bära påståendet. A är detail_as_main med uppgraderad slutsats: Elmerud sägs uttryckligen inte ha mätt kunskapsutveckling ”över huvud taget”, så ett påstående om vad läxor betyder för lärandet är precis det hans material inte kan ge — felet är identifierbart och alternativet är inte sant ens delvis. B är overgeneralisation: den drar textens kritik till ett avskaffandekrav som skribenten avvisar i klartext (”Jag är ingen läxmotståndare”) och som motsägs av försvaret för högläsning och glosor. C är scope_shift på en eftergift: att skolan inte hinner med kursinnehållet kallas i texten ”ett verkligt bekymmer”, men uttryckligen schemats bekymmer och inte läxans, varför alternativet både byter ämne och upphöjer en biomständighet till huvudsak. Ingen distraktor återger alltså en uppgift i texten ordagrant korrekt."
  }
 ],
 "generator_meta": {
  "origin": "batch12-generator",
  "model": "claude-opus-4-8",
  "date": "2026-07-29",
  "size": "short",
  "macro_genre": "sakprosa",
  "fine_genre": "debatt_opinion",
  "opening_move": "framing-claim",
  "topic": "läxor i grundskolan",
  "question_families": {
   "1": "enligt_texten_detalj",
   "2": "huvudbudskap_syfte"
  },
  "planted_traps": {
   "1": {
    "A": "reversed_causality (omvänd rangordning)",
    "C": "overgeneralisation",
    "D": "scope_shift (rätt uppgift, fel avgränsning)"
   },
   "2": {
    "A": "detail_as_main (slutsats bortom det mätta)",
    "B": "overgeneralisation",
    "C": "scope_shift på eftergift"
   }
  },
  "key_spread": [
   "B",
   "D"
  ],
  "hedge_balance": "Båda nycklarna är konfidenta, specifika påståenden; ingen av dem är setets enda kvalificerade alternativ. Q1: de enda garderade formuleringarna sitter i distraktorerna (”ungefär lika stor” i C, ”oftast” i D), medan nyckeln B är rakt och specifikt formulerad — valet avgörs av rangordningens riktning, inte av gardering. Q2: den mest garderade formuleringen (”förhållandevis lite”) sitter i distraktor A och den mest absoluta (”bör avskaffas”, ”systematiskt”) i B, medan nyckeln D är rakt formulerad. Att välja det mest nyanserade alternativet ger alltså fel svar.",
  "cross_question_check": "Nycklarna hävdar olika satser: Q1 är en ämnesvis rangordning av spridningen (matematik störst, högläsning minst), Q2 är textens övergripande tes om att läxan förflyttar arbetet och därmed mäter hemmet. Q1:s nyckel avslöjar inte tesen — man kan känna till rangordningen utan att kunna sluta sig till Q2:s nyckel — och inget av Q1:s alternativ nämner hemmet, hjälpen eller ansvaret. Q2:s alternativ nämner varken ämnena, tiderna eller rangordningen och kan alltså inte stödja Q1.",
  "law11_check": "Q2 är ett ”överensstämmer bäst”-item: varje distraktor bär ett utpekbart fel — A påstår något om lärandet som studien uttryckligen inte har mätt, B kräver ett avskaffande som skribenten avvisar i klartext, C gör en eftergift som texten hänför till schemat till skolans största problem. Ingen distraktor är en ordagrant sann detalj vid sidan av tesen.",
  "self_blind_solve": "Löste hela frågesetet som ett ark enbart utifrån passagen och argumenterade aktivt för varje icke-nyckel. Q1=B (A är rangordningen spegelvänd, C suddar ut ämnesskillnaden texten redovisar, D flyttar ”blev inte gjort” från hemmen till ämnet). Q2=D (A överskrider det Elmerud säger sig inte ha mätt, B kolliderar med ”Jag är ingen läxmotståndare”, C tar en eftergift texten hänför till schemat och gör den till huvudsak). Inget alternativ återger en passagemening ordagrant. Samtliga namn och institutioner är påhittade: Torbjörn Elmerud, Lärarhögskolan i Vretstorp, Marit Hallgren."
 }
}