{
 "candidate_id": "las-b2-002",
 "section": "LÄS",
 "family": "skolmatslogistik-debatt-short",
 "title": "Vad centralköket inte kan väga",
 "passage": "Häggnora kommun har bestämt att de sju skolköken ska tystna. Från och med hösten lagas all skolmat i ett enda centralkök i Fagerhammar och körs sedan ut till skolorna. På papperet är beslutet enkelt: varje portion beräknas kosta fyra kronor mindre. Jag har lagat mat åt barnen på Klöverhagsskolan i nitton år, och jag menar att kommunen räknar på fel sak.\n\nLåt mig vara tydlig. Jag försvarar inte allt som är gammalt, och att spara pengar är i sig inget fel — fyra kronor är fyra kronor. Ett centralkök är dessutom renare, och märkningen av allergener blir säkrare när den sköts av ett fåtal utbildade händer i stället för av oss alla. Det ska erkännas. Men ett tillagningskök gör också något som ingen kalkyl fångar. När det doftar stekt lök i korridoren vid tiotiden vet barnen att någon lagar mat åt just dem. Kocken syns, kan tillfrågas, kan salta om och byta ut det som inte fungerar just den dagen. Ett mottagningskök värmer bara det som redan är bestämt någon annanstans.\n\nErfarenheten borde mana till eftertanke. I grannkommunen Ödsberga, där tre skolor gick över till levererad mat redan i fjol, tycktes matsvinnet öka — men framför allt hos de lägre klasserna, och nästan bara när det var lagad varm mat på tallriken. Ingen vet säkert varför. Kanske smakar en gryta annorlunda efter en timme i en transportlåda; kanske äter man mindre av mat man aldrig sett bli till.\n\nJag begär inte att varje skola för alltid ska ha ett eget kök. För kalla mackor och frukt spelar det ingen roll var de packas. Men den varma måltiden mitt på dagen är för många barn dagens tryggaste stund, och den bör vägas med något mer än kronor per portion. Innan de sista spisarna släcks borde fullmäktige säga rakt ut vad besparingen faktiskt kostar.\n— Birgitta Tjärnfeldt, skolkock i Häggnora\n\ntillagningskök = kök där maten lagas från grunden; mottagningskök = kök som värmer och portionerar levererad mat",
 "questions": [
  {
   "q_index": 1,
   "prompt": "Vilken kritik riktar skribenten mot kommunens beslut?",
   "options": [
    {
     "letter": "A",
     "text": "Att skolmat aldrig kan bli riktigt bra om den inte lagas i varje skolas eget kök."
    },
    {
     "letter": "B",
     "text": "Att beslutet bara väger det räknebara och förbigår värden som barnens vardagliga kontakt med maten."
    },
    {
     "letter": "C",
     "text": "Att ett centralkök gör skolmåltiden mindre säker för elever som har allergier."
    },
    {
     "letter": "D",
     "text": "Att den utlovade besparingen på fyra kronor per portion är alldeles för liten."
    }
   ],
   "key": "B",
   "rationale": "Nyckeln B spänner över skribentens hela hållning: hon säger rakt ut att kommunen ”räknar på fel sak” och att tillagningsköket gör ”något som ingen kalkyl fångar” (kocken syns, kan tillfrågas, kan anpassa maten). Kritiken gäller alltså att beslutet bara väger det mätbara. A är overgeneralisation: ”aldrig ... i varje skolas eget kök” absolutiserar en hållning hon uttryckligen tar avstånd från — hon skriver att hon inte begär att varje skola för alltid ska ha eget kök och att kalla mackor kan packas var som helst. C är reversed_causality/motsägelse: hon medger tvärtom att ”märkningen av allergener blir säkrare” i centralköket, så påståendet vänder hennes egen invändning. D är detail_as_main/true_but_irrelevant: besparingen på fyra kronor nämns, men hon bestrider aldrig siffran — hon skriver ”fyra kronor är fyra kronor” och att det inte är fel att spara; hennes poäng är att man optimerar fel storhet, inte att beloppet är för litet."
  },
  {
   "q_index": 2,
   "prompt": "Vad visade försöket i Ödsberga, enligt texten?",
   "options": [
    {
     "letter": "A",
     "text": "Där matsvinnet var som allra störst valde skolorna själva att gå över till den levererade maten."
    },
    {
     "letter": "B",
     "text": "Alla elever slängde mer mat, alldeles oavsett vilken rätt som serverades den dagen."
    },
    {
     "letter": "C",
     "text": "Den levererade maten sänkte kostnaden per portion i de tre försöksskolorna."
    },
    {
     "letter": "D",
     "text": "Svinnet steg troligen, mest hos de yngre barnen och främst vid de varma rätterna."
    }
   ],
   "key": "D",
   "rationale": "Nyckeln D parafraserar den planterade, hedgade och avgränsade iakttagelsen: ”tycktes matsvinnet öka — men framför allt hos de lägre klasserna, och nästan bara när det var lagad varm mat”. Hedgen (tycktes/troligen), riktningen (levererad mat → mer svinn) och avgränsningen (yngre barn, varma rätter) bevaras. A är reversed_causality: den vänder pilen så att stort svinn skulle ha lett till bytet, medan texten säger att bytet kom först. B är overgeneralisation: ”alla elever, oavsett rätt” stryker just de avgränsningar texten gör (lägre klasser, varma rätter). C är scope_shift: kostnaden per portion hör till Häggnoras kalkyl (fyra kronor mindre), inte till Ödsbergaförsöket, som handlade om svinn — texten säger aldrig att Ödsbergas portionspris sjönk."
  }
 ],
 "generator_meta": {
  "origin": "batch2-las-short-debatt",
  "model": "claude-opus-4-8[1m]",
  "date": "2026-07-21",
  "size": "short",
  "macro_genre": "sakprosa",
  "fine_genre": "debatt_opinion",
  "opening_move": "framing-claim",
  "question_families": {
   "1": "forfattarens_hallning",
   "2": "enligt_texten_detalj"
  },
  "planted_traps": {
   "1": {
    "A": "overgeneralisation",
    "C": "reversed_causality",
    "D": "detail_as_main"
   },
   "2": {
    "A": "reversed_causality",
    "B": "overgeneralisation",
    "C": "scope_shift"
   }
  },
  "key_spread": [
   "B",
   "D"
  ],
  "self_blind_solve": "Blindlöst båda från passagen; exakt ett försvarbart svar per fråga (Q1=B, Q2=D). Alla entiteter fiktiva (Häggnora, Fagerhammar, Klöverhagsskolan, Ödsberga, Birgitta Tjärnfeldt); ingen känd tes anknyts.",
  "originality_note": "Real-entity repair 2026-07-30 (pedagogy-review/opus); verification re-run against live sources 2026-08-04. The bank-wide audit flagged 'Sörgårdsskolan' as a COLLISION: Skolverkets skolenhetsregister (uttag 2026-08-04, 10 630 units) lists four real school units with that exact name (Mölndal, Gislaved, Vällingby/Stockholm plus 'Fritidshemmet Sörgården'), and this passage is a signed first-person insändare that attaches an invented nineteen-year career and a fabricated kitchen closure to it. Every other named entity was swept as well. RENAMES: Sörgårdsskolan -> Klöverhagsskolan; Kvarnby (kommun) -> Häggnora (Kvarnby is a real Malmö district with a real Kvarnby folkhögskola, and the register holds two real 'Kvarnbyskolan' units - same domain); Almvik -> Fagerhammar (Almvik is a real småort in Västervik kommun); Rörsta -> Ödsberga (the passage attaches a fabricated matsvinn finding to it, the highest-risk claim after the school); Birgitta Åkerlund -> Birgitta Tjärnfeldt (surname retired as saturated in this bank). VERIFICATION of each replacement - Klöverhagsskolan/Klöverhagen, Häggnora, Fagerhammar, Ödsberga, Tjärnfeldt: zero hits in Skolverkets skolenhetsregister, zero Wikidata entities (sv), zero sv- and en-Wikipedia full-text hits, and no exact bearer in broad web search. REJECTED during verification because a real bearer turned up: Tegelhyttan (ISOF: lht in Hörja sn, plus common noun), Vässinge (Stora Vässinge, Eskilstuna), Norrhammar (Skellefteå stadsdel + Norrhammarskolan), Bråtnäs (naturreservat, Bengtsfors), Ekhamra and Kvistberga (real school units), Grindsjö (Grindsjön, Botkyrka/Nynäshamn), Lomsjöbo (near-name of Lomsjö, Åsele), Näverbo and Hällmyra (real places), Vallmark (Sven Vallmark, translator), Tallhamn (Filip Tallhamn, actor), Nybrink (real Swedish journalists). Also checked and deliberately avoided: 'Tegel-' as a stem, already carried by three names in las-b12-002. None of the five new names occurs in any other shipped candidates-final unit. ANSWER DESIGN UNTOUCHED: option letters (A-D, A-D), option texts and keys (Q1=B, Q2=D) are byte-identical to the pre-repair file; no entity name appears in any option."
 }
}