{
 "candidate_id": "las-b12-002",
 "section": "LÄS",
 "family": "offentliga-toaletter-debatt-short",
 "title": "Toaletterna försvinner utan att någon beslutar det",
 "passage": "Nedläggningen av en offentlig toalett ser sällan ut som ett beslut. Den börjar med en lapp om tillfälligt stängt, fortsätter med en bortmonterad dörr och slutar med en planteringsyta. Något protokoll behöver inte skrivas, eftersom ingenting formellt har avvecklats. Driftkostnaden går däremot att räkna fram på en eftermiddag, och det är den siffran som avgör.\n\nSinikka Vaara vid Institutet för stadsnära tjänster i Norrköping har inventerat elva medelstora kommuner mellan 2019 och 2024. Antalet öppna toaletter i centrala lägen hade under perioden minskat med drygt en tredjedel. Parallellt lät hon femhundra personer föra dagbok över en vanlig lördag. Bland dem som uppgav att de numera sällan rör sig ensamma i staden återkom en förklaring oftare än väntat: ovissheten om var man kan gå på toaletten. Sambandet var tydligast hos de äldsta deltagarna och hos dem med tarmsjukdom. För barnfamiljer gick det knappt att belägga alls; de planerar ändå sina rundor efter caféer.\n\nInvändningarna mot att bygga nytt är inte tomma. En bemannad bekvämlighetsinrättning kostar mer per besök än vad de flesta kommunalråd gärna redovisar, och de obemannade slits hårt, låses och glöms bort. Vaara medger också att hennes material inte kan skilja orsak från ordningsföljd: den som redan drar sig för att gå ut lägger förstås märke till bristen tydligare än andra.\n\nÄndå försvinner inte kostnaden av att en post stryks ur budgeten. Den byter betalare. Caféerna och varuhusen har blivit stadens toaletter, och de tar betalt i form av ett köp, en kod på kvittot, en blick från kassan. Vem som helst klarar den avgiften en gång. Att klara den varje gång, varje dag, är något annat.\n\nJag begär ingen toalett i varje kvarter. Men i Sandviken står fortfarande en gjutjärnspissoar från 1927 som ingen förvaltning vill kännas vid. Den städas av en pensionerad rörmokare på eget bevåg, och kommunen har varken avvecklat den eller tagit ansvar för den. Ungefär så brukar det se ut. Ingen bestämmer sig, och sedan är saken ändå bestämd.\n— Ola Rimfeldt, planeringsarkitekt\n\nbekvämlighetsinrättning = äldre benämning på offentlig toalett",
 "questions": [
  {
   "q_index": 1,
   "prompt": "Vad kom fram i Sinikka Vaaras undersökning av de elva kommunerna?",
   "options": [
    {
     "letter": "A",
     "text": "Att de äldre invånarna rörde sig allt mindre i staden var skälet till att kommunerna stängde toaletterna."
    },
    {
     "letter": "B",
     "text": "Minskningen med drygt en tredjedel gällde kommunernas toaletter i stort, alltså även parkernas och badplatsernas."
    },
    {
     "letter": "C",
     "text": "De som numera sällan går ut ensamma angav ofta osäkerheten kring toaletter, särskilt bland de äldsta."
    },
    {
     "letter": "D",
     "text": "Barnfamiljerna framstod som den grupp vars vardag påverkades tydligast av de stängda toaletterna."
    }
   ],
   "key": "C",
   "rationale": "Nyckeln C parafraserar det planterade fyndet i stycke 2: bland dem som uppgav att de numera sällan rör sig ensamma i staden återkom ovissheten om var man kan gå på toaletten som förklaring, och sambandet var tydligast hos de äldsta deltagarna. Riktningen (toalettovisshet som skäl att inte ge sig ut) och avgränsningen (de äldsta, samt personer med tarmsjukdom) står båda uttryckligen i texten; formuleringen är omskriven, inte lyft. A är reversed_causality: samma två storheter, motsatt pil — här får de äldres minskade rörlighet förklara kommunernas nedläggningar, medan texten säger att det är driftkostnaden ”som avgör”. Fällan är stark eftersom vikande besökssiffror är ett fullt rimligt nedläggningsskäl i verkligheten, och en textblind läsare har inget sätt att avfärda den. B är scope_shift: siffran ”drygt en tredjedel” gäller enligt texten toaletter ”i centrala lägen”, inte kommunernas bestånd i stort; en läsare som minns talet men inte avgränsningen fastnar. D är plausible_worldknowledge på ett förvrängt textställe: barnfamiljer nämns faktiskt, men just som den grupp där sambandet ”knappt gick att belägga alls”, eftersom de ändå planerar efter caféer. Att småbarnsfamiljer skulle vara de mest toalettberoende är samtidigt den mest närliggande vardagsgissningen, vilket gör alternativet lockande utan att det är ordagrant sant."
  },
  {
   "q_index": 2,
   "prompt": "Vilken invändning riktar skribenten mot att toaletterna försvinner?",
   "options": [
    {
     "letter": "A",
     "text": "Att utgiften inte upphör utan landar hos besökarna i stället för hos kommunen."
    },
    {
     "letter": "B",
     "text": "Att kommunerna borde bygga bemannade toaletter i varje kvarter i innerstaden, öppna dygnet runt."
    },
    {
     "letter": "C",
     "text": "Att skadegörelsen, inte driftkostnaden, är det verkliga skälet till att toaletterna blir färre."
    },
    {
     "letter": "D",
     "text": "Att caféernas toaletter är för få och alltför svåra att hitta för besökare."
    }
   ],
   "key": "A",
   "rationale": "Nyckeln A återger den hållning skribenten själv driver i stycke 4: när posten stryks ur budgeten upphör inte utgiften, den byter betalare — caféer och varuhus tar betalt i form av ett köp, och den som behöver gå ofta betalar varje gång. Alternativet är en omskrivning, inte ett citat, och det är den enda invändning texten faktiskt hävdar. B är plausible_worldknowledge: det är den position man förväntar sig av någon som försvarar offentliga toaletter, men texten tar uttryckligen avstånd från den (”Jag begär ingen toalett i varje kvarter”), och stycke 3 medger dessutom att kostnaden per besök är hög. Felet är identifierbart — en position som texten uttryckligen avsäger sig. C är detail_as_main med felaktig attribution: skadegörelsen finns i texten, men som en av invändningarna mot att bygga nytt, medan skribenten i stycke 1 pekar ut driftkostnaden som det som avgör; alternativet upphöjer alltså en biomständighet till huvudorsak och vänder samtidigt på textens egen rangordning. D är true_but_irrelevant i förvrängd form: caféerna diskuteras verkligen, men klagomålet gäller att de tar betalt genom ett köp, inte att de skulle vara för få eller svårhittade — texten säger tvärtom att de ”har blivit stadens toaletter”. Ingen distraktor är alltså ordagrant sann; var och en bär ett utpekbart fel."
  }
 ],
 "generator_meta": {
  "origin": "batch12-generator",
  "model": "claude-opus-4-8",
  "date": "2026-07-29",
  "size": "short",
  "macro_genre": "sakprosa",
  "fine_genre": "debatt_opinion",
  "opening_move": "framing-claim",
  "topic": "de offentliga toaletternas försvinnande ur staden",
  "question_families": {
   "1": "detalj_ospecificerad",
   "2": "forfattarens_hallning"
  },
  "planted_traps": {
   "1": {
    "A": "reversed_causality",
    "B": "scope_shift",
    "D": "plausible_worldknowledge (förvrängd detalj)"
   },
   "2": {
    "B": "plausible_worldknowledge (uttryckligen avsagd position)",
    "C": "detail_as_main (omkastad rangordning av skäl)",
    "D": "true_but_irrelevant (fel klagomål om caféerna)"
   }
  },
  "key_spread": [
   "C",
   "A"
  ],
  "hedge_balance": "Ingen distraktor är kvalificerad medan nycklarna är tvärsäkra, och tvärtom: båda nycklarna är rakt formulerade, specifika påståenden. Q1: A, B och D är alla lika konfidenta som nyckeln, och den enda kvantifierande formuleringen (”drygt en tredjedel”) sitter i en distraktor. Q2: den mest absoluta formuleringen (”varje kvarter … dygnet runt”) sitter i B, inte i nyckeln; ”pick the qualified answer” ger fel svar på båda frågorna.",
  "cross_question_check": "Nycklarna hävdar olika satser: Q1 är ett empiriskt fynd om vilka som uppgav toalettovisshet som skäl att inte gå ut ensamma; Q2 är skribentens ekonomiska invändning om att utgiften byter betalare. Ingen av dem följer av den andra. Q1:s alternativ nämner inte kostnadsförskjutning; Q2:s alternativ nämner varken dagboksstudien, åldersgrupperna eller tredjedelen, så inget alternativsett avslöjar den andra frågans nyckel.",
  "self_blind_solve": "Löste hela frågesetet som ett ark enbart utifrån passagen och argumenterade aktivt för varje icke-nyckel. Q1=C (A vänder pilen mot textens uttryckliga kostnadsförklaring, B vidgar tredjedelen förbi ”centrala lägen”, D gör den grupp där sambandet saknades till den mest drabbade). Q2=A (B är den position texten avsäger sig, C byter ut driftkostnaden mot skadegörelsen, D klagar på fel sak hos caféerna). Inget alternativ återger en passagemening ordagrant. Samtliga namn och institutioner är påhittade: Sinikka Vaara, Institutet för stadsnära tjänster, Ola Rimfeldt; endast ortnamn (Norrköping, Sandviken) är verkliga, i linje med korpusbruket."
 }
}