{
 "candidate_id": "las-b9-003",
 "section": "LÄS",
 "family": "offentliga-ur-essa-short",
 "title": "När staden slutade se upp mot klockan",
 "passage": "Uret på Sörby läroverk har visat tio i fyra sedan någon gång på nittiotalet. Ingen tycks störas av det. Just den likgiltigheten säger mer om staden än ett stillastående urverk borde göra.\n\nTeknikhistorikern Marianne Ekvall har inventerat nittiosex offentliga ur i tre mellansvenska städer. Uppdraget var prosaiskt: kommunerna ville veta vilka ur som var värda att laga. Resultatet blev ändå en sorts karta över vad tiden en gång var till för. Av de trettiotvå ur som fortfarande visade rätt tid stod tjugosju vid ett färjeläge, en busstation, en skolgård eller en fabriksgrind. De påkostade uren — kyrktornens, bankfasadernas, de med förgyllda visare — gick oftare fel.\n\nSkillnaden handlar enligt Ekvall inte om pengar utan om vem som behöver uret. Ett ur som någon dagligen rättar sig efter blir lagat, inte sällan av någon som inte har det i sin arbetsbeskrivning. Ett ur som bara pryder blir putsat men inte ställt.\n\nDen vanliga förklaringen till att stadens ur tystnat är armbandsuret och sedan mobiltelefonen. Den räcker inte. Armbandsur var vanliga långt innan uren började stanna, och Sörby satte upp sitt sista nya torgur så sent som 1961. I Sörby markerade dessutom sågverkets vissla skiftbytena ända in på sextiotalet, men visslan ersatte aldrig uret — den förutsatte det. Det som försvann var något annat: verksamheter som behövde samla många människor vid samma minut. När skiftgången luckrades upp, när färjan började gå var tjugonde minut i stället för fyra gånger om dagen, när skolan slutade ringa in på gården, blev den gemensamma tiden en privatsak.\n\nBilden är inte entydig. Ett par av de välskötta uren i materialet står vid torg utan någon avgång alls, underhållna av en handelsförening som helt enkelt tycker att fel tid ser illa ut. Ekvall är också noga med att tre städer inte är hela landet; på orter med kvarvarande industri kan mönstret se annorlunda ut.\n\nÄndå säger inventeringen något om vad ett offentligt ur var. Det var inte i första hand en dekoration eller en donators gåva, utan en överenskommelse: här gäller den här minuten, och den gäller oss alla. Överenskommelser förfaller när ingen längre behöver dem. Uret på läroverket har inte gått sönder på något djupare sätt än så.\n— Petra Sundelius, essäist\n\nfärjeläge = plats där en färja lägger till och tar ombord passagerare\ntorgur = fristående offentligt ur på ett torg eller en öppen plats",
 "questions": [
  {
   "q_index": 1,
   "prompt": "Vad framkom, enligt texten, vid Ekvalls inventering av de offentliga uren?",
   "options": [
    {
     "letter": "A",
     "text": "De mest påkostade uren visade sig vara de bäst underhållna, medan enklare ur vid hållplatser och skolgårdar oftare hade stannat helt."
    },
    {
     "letter": "B",
     "text": "Ur vid platser med fasta avgångstider gick alltid rätt, medan varje ur på en kyrka eller bankfasad hade stannat."
    },
    {
     "letter": "C",
     "text": "De ur som fortfarande gick rätt stod vid färjelägen, busstationer och skolgårdar snarare än på kyrktorn och bankfasader."
    },
    {
     "letter": "D",
     "text": "Inventeringen visade att sågverkets vissla hade tagit över tidhållningen från stadens ur redan under mellankrigstiden."
    }
   ],
   "key": "C",
   "rationale": "Nyckeln C parafraserar siffrorna i stycke 2: av de trettiotvå ur som fortfarande visade rätt tid stod tjugosju vid ett färjeläge, en busstation, en skolgård eller en fabriksgrind, medan de påkostade uren på kyrktorn och bankfasader oftare gick fel. A är reversed_causality: den behåller samma två kategorier men vänder på utfallet, så att pengar och prakt får förklara underhållet — vilket är precis det Ekvall avvisar i stycke 3. Den är den farligaste distraktorn, eftersom antagandet att dyrbara föremål sköts bäst är starkt utan texten. B är overgeneralisation: texten säger 'oftare fel', inte att varje kyrk- eller bankur stannat, och den räknar tjugosju av trettiotvå — alltså inte heller 'alltid rätt' vid avgångsplatserna; fem av de fungerande uren stod någon annanstans, och stycke 5 nämner välskötta ur vid torg utan avgångar. D är scope_shift med ytligt textbelägg: sågverkets vissla nämns i stycke 4, men där sägs uttryckligen att den aldrig ersatte uret utan förutsatte det, och att den markerade skiftbyten in på sextiotalet, inte under mellankrigstiden."
  },
  {
   "q_index": 2,
   "prompt": "Vilket påstående överensstämmer bäst med texten?",
   "options": [
    {
     "letter": "A",
     "text": "Uret var främst en gemensam överenskommelse om tiden, och det förföll när färre verksamheter behövde samla folk samtidigt."
    },
    {
     "letter": "B",
     "text": "Ekvalls inventering gjordes för att avgöra vilka av städernas ur som borde byggnadsminnesmärkas."
    },
    {
     "letter": "C",
     "text": "Sedan alla bär en klocka i fickan fyller stadens offentliga ur inte längre någon praktisk uppgift."
    },
    {
     "letter": "D",
     "text": "Uren stannade därför att kommunerna slutade underhålla dem, vilket i sin tur fick verksamheterna att överge sina fasta avgångstider."
    }
   ],
   "key": "A",
   "rationale": "Nyckeln A spänner över hela texten: fyndet (de fungerande uren stod där avgångar och skiftbyten samlade folk), förklaringen (ett ur som någon dagligen rättar sig efter blir lagat) och slutsatsen i sista stycket (uret var i första hand en överenskommelse, och överenskommelser förfaller när ingen behöver dem). Formuleringen 'främst' håller kvar textens förbehåll om torguren utan avgångar. B bär ett identifierbart sakfel (detail_as_main med förvanskning enligt lag 11): uppdraget var enligt stycke 2 att avgöra vilka ur som var värda att laga, inte vilka som borde byggnadsminnesmärkas, och uppdraget är dessutom ett metoddelspår, inte budskapet. C är overgeneralisation av just den förklaring texten avvisar: 'Den räcker inte', och stycke 3 beskriver ur som fortfarande lagas av dem som behöver dem, så 'inte längre någon praktisk uppgift' pressar tesen förbi texten. D är reversed_causality: texten låter det bortfallna behovet komma först och det uteblivna underhållet följa, medan D vänder pilen och låter uteblivet underhåll orsaka att avgångstiderna övergavs."
  }
 ],
 "generator_meta": {
  "origin": "batch9-generator",
  "model": "claude-opus-4-8",
  "date": "2026-07-26",
  "size": "short",
  "macro_genre": "sakprosa",
  "fine_genre": "essa",
  "opening_move": "scene",
  "question_families": {
   "1": "enligt_texten_detalj",
   "2": "huvudbudskap_syfte"
  },
  "planted_traps": {
   "1": {
    "A": "reversed_causality",
    "B": "overgeneralisation",
    "D": "scope_shift"
   },
   "2": {
    "B": "detail_as_main",
    "C": "overgeneralisation",
    "D": "reversed_causality"
   }
  },
  "key_spread": [
   "C",
   "A"
  ],
  "self_blind_solve": "Solved both from the passage alone. Q1=C only: 27 of the 32 still-correct clocks stood by ferry berths, bus stations, schoolyards or factory gates while the costly ones went wrong more often; A reverses that outcome, B absolutises it past 'oftare fel' and past the 27-of-32 count, D distorts the sawmill whistle passage in two ways (it never took over, and it ran into the sixties). Q2=A only: it spans finding, mechanism and closing claim while keeping the caveat via 'främst'; B misstates the survey's stated purpose (worth repairing, not listed as heritage), C absolutises the wristwatch/phone explanation the text explicitly rejects, D inverts the causal order. Hedge balance: Q1 key C is a plain, confident locational claim while distractor A is the measured-sounding one ('oftare'), so the qualified option is wrong there; Q2 key A is the hedged one — the correlation is broken across the unit. Key never the single longest option (Q1 longest = A, Q2 longest = D). All entities fictional (Sörby läroverk, Marianne Ekvall, Petra Sundelius); no famous-thesis anchoring."
 }
}