{
  "candidate_id": "elf-b15-002",
  "section": "ELF",
  "family": "ELF-CLOZE-001 / village-noticeboard-pruning-society-commentary-cloze",
  "title": "Drawing Pins",
  "passage": "The noticeboard in the porch of the Denhollow reading room is a metre of cork in a wooden frame; on the ledge beside it stands a jam jar of drawing pins that anyone may use. Nobody asks permission. Nothing is signed. What governs it is a rule, unwritten and perfectly well known: on the first Monday of the month, every card without a date on it comes down. The rule ___(1)___ nobody’s feelings. Anything with a price on it gets short ___(2)___, so a card advertising guttering repairs is lucky to see a fortnight, while a card asking for help with the churchyard may stay up all summer. Wilf Braddick, who has held the key since the last caretaker gave it up, does the taking down, and what counts as current is left to his discretion. No one voted for that.\n\nWhat the board is for takes a while to see. Almost none of it is trade. A ladder wanted for one weekend; a lift to the coast on a Thursday; half a sack of daffodil bulbs going spare; tenors wanted, urgently, by a choir that has four. These are errands too small to be worth arranging any other way, and what makes them possible is not neighbourliness but ___(3)___. A card that draws no reply has not been refused. It has only gone unread, and being unread is something a person can live next door to.\n\nNone of it can be checked. Nobody writes down what was asked for, and nobody writes down what came of it, so there is no telling whether the ladder was ever lent. Most of what goes up ___(4)___ to nothing. As a way of running anything it is indefensible on ordinary grounds – unaccountable, unmeasured, and administered by one man with a jam jar. ___(5)___, no one in Denhollow has proposed replacing it, and the cards still go up as they always have. Braddick takes them down once they have begun to look sad. The exception is a typed card offering piano lessons, pinned by a woman who stopped teaching in 2014; it has come through more than a decade of first Mondays untouched, on the grounds that taking it down would be a statement and leaving it up is not.\n– Verity Padgham, weekend columnist",
  "questions": [
    {
      "q_index": 1,
      "prompt": "Gap (1)",
      "options": [
        {
          "letter": "A",
          "text": "serves"
        },
        {
          "letter": "B",
          "text": "saves"
        },
        {
          "letter": "C",
          "text": "spares"
        },
        {
          "letter": "D",
          "text": "spoils"
        }
      ],
      "key": "C"
    },
    {
      "q_index": 2,
      "prompt": "Gap (2)",
      "options": [
        {
          "letter": "A",
          "text": "shrift"
        },
        {
          "letter": "B",
          "text": "thrift"
        },
        {
          "letter": "C",
          "text": "drift"
        },
        {
          "letter": "D",
          "text": "shift"
        }
      ],
      "key": "A"
    },
    {
      "q_index": 3,
      "prompt": "Gap (3)",
      "options": [
        {
          "letter": "A",
          "text": "interference"
        },
        {
          "letter": "B",
          "text": "deference"
        },
        {
          "letter": "C",
          "text": "inference"
        },
        {
          "letter": "D",
          "text": "indifference"
        }
      ],
      "key": "D"
    },
    {
      "q_index": 4,
      "prompt": "Gap (4)",
      "options": [
        {
          "letter": "A",
          "text": "carries"
        },
        {
          "letter": "B",
          "text": "comes"
        },
        {
          "letter": "C",
          "text": "cuts"
        },
        {
          "letter": "D",
          "text": "counts"
        }
      ],
      "key": "B"
    },
    {
      "q_index": 5,
      "prompt": "Gap (5)",
      "options": [
        {
          "letter": "A",
          "text": "Accordingly"
        },
        {
          "letter": "B",
          "text": "Furthermore"
        },
        {
          "letter": "C",
          "text": "Nonetheless"
        },
        {
          "letter": "D",
          "text": "Correspondingly"
        }
      ],
      "key": "C"
    }
  ]
}
