{
 "candidate_id": "las-b10-003",
 "section": "LÄS",
 "family": "hundrastgardar-delade-ytor-debatt-short",
 "title": "Staket löser sällan det som gnisslar i parken",
 "passage": "Hundrastgården har blivit kommunernas standardsvar. Där klagomålen på lösa hundar hopar sig ritas ett staket in, ärendet avslutas och ingen återkommer till frågan. Just att svaret så sällan följs upp har gjort det bekvämt.\n\nLandskapsforskaren Hedvig Almstierna har inventerat trettioen hundrastgårdar i sex kommuner under 2022 och 2023. Hennes material talar framför allt om läge. De inhägnader som lagts i parkens kant, intill ett stråk där folk ändå passerade, användes flera gånger så mycket som de som hamnat på restytor bakom parkeringar eller vid bullerplank. Storleken betydde mindre än väntat. På de svagt använda platserna minskade dessutom inte klagomålen på lösa hundar i den omgivande parken; de förflyttades i stället till andra tider på dygnet.\n\nAlmstierna drar inte slutsatsen att inhägnader är fel. Hon påpekar att sex kommuner är ett litet underlag och att hon inte har kunnat mäta hur många som slutade gå till parken över huvud taget. Däremot menar hon att kommunerna har mätt fel sak: antalet anlagda rastgårdar i stället för hur de delade ytorna faktiskt används.\n\nHär ligger min invändning. En hundrastgård är inte i första hand en anläggning för hundar. Den är ett sätt att fördela en yta som flera grupper gör anspråk på samtidigt. Byggs den där ingen ändå rör sig har fördelningen inte ägt rum; den har bara skrivits in på en karta. Att det finns skäl att hägna in ser jag mycket väl. Småbarnsföräldrar ska slippa väga sitt barns rädsla mot någon annans hund, och den som är rädd för hundar har rätt till en parkbänk. Men det skälet talar för bättre placerade inhägnader, inte för fler.\n\nDelade ytor blir sällan bra av att delas upp med staket. De blir bra av att någon först har frågat vem som rör sig var, och när. Den frågan kostar mindre än ett stängsel och ställs betydligt mer sällan.\n— Elias Vretberg, landskapsarkitekt\n\nrestyta = markbit som blivit över mellan andra anläggningar",
 "questions": [
  {
   "q_index": 1,
   "prompt": "Vad framkom, enligt texten, i Almstiernas inventering av de trettioen hundrastgårdarna?",
   "options": [
    {
     "letter": "A",
     "text": "Inhägnader i parkens kant intill ett gångstråk användes betydligt mer än de som lagts på överblivna ytor."
    },
    {
     "letter": "B",
     "text": "De inhägnader som låg i parkens kant hade placerats där för att hundägarna redan samlades på platsen."
    },
    {
     "letter": "C",
     "text": "I de svagt använda parkerna flyttade sig klagomålen på lösa hundar till andra platser i staden."
    },
    {
     "letter": "D",
     "text": "Klagomålen på lösa hundar upphörde helt i alla parker där en inhägnad hade anlagts under de två åren."
    }
   ],
   "key": "A",
   "rationale": "Nyckeln A parafraserar inventeringens huvudiakttagelse i stycke 2: de inhägnader som lagts i parkens kant, intill ett stråk där folk ändå passerade, användes flera gånger så mycket som de som hamnat på restytor bakom parkeringar eller vid bullerplank. Riktningen är läge → användning, och glosan definierar restyta som markbit som blivit över, vilket nyckelns \"överblivna ytor\" återger utan att låna formuleringen. B är reversed_causality: pilen vänds så att hundägarnas rörelser skulle ha bestämt inhägnadernas läge. Den lockar eftersom texten mycket riktigt talar om stråk där folk ändå passerade, men den meningen beskriver var inhägnaden hamnade i förhållande till ett befintligt stråk, inte att kommunerna följde hundägarna. C är en detaljförvrängning med surface_lexical_echo: texten säger att klagomålen på de svagt använda platserna inte minskade utan förflyttades till andra tider på dygnet, inte till andra platser i staden. Ett enda utbytt ord skiljer alternativet från texten, vilket gör det till det svåraste av de tre. D är overgeneralisation: att klagomålen skulle ha upphört helt i alla parker motsägs direkt av att de på de svagt använda platserna inte minskade alls."
  },
  {
   "q_index": 2,
   "prompt": "Vilket påstående överensstämmer bäst med texten?",
   "options": [
    {
     "letter": "A",
     "text": "Inhägnader bör inte byggas i parker, eftersom klagomålen ändå bara flyttar sig till andra tider på dygnet."
    },
    {
     "letter": "B",
     "text": "Almstiernas viktigaste resultat var att inhägnadernas storlek saknade betydelse för hur mycket de kom att användas."
    },
    {
     "letter": "C",
     "text": "Konflikter om parkytor beror främst på att staden förtätas och att grönytorna per invånare blir färre."
    },
    {
     "letter": "D",
     "text": "Frågan om hundrastgårdar handlar mindre om antalet än om var de placeras och för vem."
    }
   ],
   "key": "D",
   "rationale": "Nyckeln D spänner över hela texten: kommunernas standardsvar räknas i antal staket (stycke 1), inventeringen visar att läget är det som avgör användningen (stycke 2), kommunerna anklagas för att ha mätt antalet anlagda rastgårdar (stycke 3), och skribentens egen slutsats är att skälen talar för bättre placerade inhägnader, inte för fler, samt att ytan ska fördelas mellan grupper som gör anspråk på den (stycke 4). A överdriver skribentens hållning så att den blir ett generellt byggförbud, vilket texten uttryckligen avvisar när den slår fast att det finns goda skäl att hägna in; dessutom absolutiseras iakttagelsen om förflyttade klagomål, som i texten gäller enbart de svagt använda platserna. B är detail_as_main med en förskjuten kvantitet: storleken sägs ha betytt mindre än väntat, inte ha saknat betydelse, och iakttagelsen är dessutom ett sidospår i förhållande till lägesresonemanget. C är plausible_worldknowledge: förtätning och krympande grönytor är en välkänd förklaring till konflikter om stadens ytor, men texten anför den aldrig och förklarar i stället konflikterna med hur ytorna fördelas och används."
  }
 ],
 "generator_meta": {
  "origin": "batch10-generator",
  "model": "claude-opus-4-8",
  "date": "2026-07-26",
  "size": "short",
  "macro_genre": "sakprosa",
  "fine_genre": "debatt_opinion",
  "opening_move": "framing-claim",
  "question_families": {
   "1": "detalj_ospecificerad",
   "2": "huvudbudskap_syfte"
  },
  "planted_traps": {
   "1": {
    "B": "reversed_causality",
    "C": "surface_lexical_echo (tider→platser)",
    "D": "overgeneralisation"
   },
   "2": {
    "A": "overgeneralisation (hållningen pressad förbi eftergiften)",
    "B": "detail_as_main (med förskjuten kvantitet)",
    "C": "plausible_worldknowledge"
   }
  },
  "key_spread": [
   "A",
   "D"
  ],
  "self_blind_solve": "Solved both from the passage alone. Q1=A only: the placement→use finding is stated directly; B reverses the arrow, C swaps 'tider' for 'platser' (the passage says the complaints moved to other times of day), D is contradicted by the sentence saying complaints did not fall at the weakly used sites. Q2=D only: the thesis runs through all four paragraphs (count of fences vs. their location and beneficiaries); A is the prescription the writer explicitly disowns, B mis-states 'mattered less than expected' as 'lacked significance' and promotes a sub-finding, C supplies an unstated real-world explanation. Law 11 check: no distractor in Q2 is verbatim-true — each carries an identifiable flaw (A overstatement + disowned stance, B quantity distortion + wrong altitude, C unsupported attribution). Hedge balance: Q1's key is the confident specific claim ('betydligt mer') while distractors B and C are measured in form and only D is absolute; Q2's key is the measured one but distractors B and C are also measured, so 'pick the qualified option' fails across the unit. Key is never the single longest option (Q1 longest = D, Q2 longest = A). All entities fictional (Hedvig Almstierna, Elias Vretberg); no famous-thesis anchoring."
 }
}